[
  {
    "id": 1,
    "name": "Angular",
    "startDate": 1457558659,
    "endDate": 1457558659
  },
  {
    "id": 2,
    "name": "React",
    "startDate": 1457558659,
    "endDate": 1457558659
  },
  {
    "id": 3,
    "name": "Meteor",
    "startDate": 1457558659,
    "endDate": 1457558659
  }
]
